Title,Description
Harry Potter - THE WORST BIRTHDAY,"
J . K . R O W L ! N G 

HARRY 

POTTER 




/ 




THE WORST BIRTHDAY 

Not for the first time, an argument had broken out 
over breakfast at number four, Privet Drive. Mr. 
Vernon Dursley had been woken in the early hours of 
the morning by a loud, hooting noise from his nephew 
Harry’s room. 

“Third time this week!” he roared across the table. “If 
you can’t control that owl, it’ll have to go!” 

Harry tried, yet again, to explain. 

“She’s bored,” he said. “She’s used to flying around 
outside. If I could just let her out at night — ” 

“Do I look stupid?” snarled Uncle Vernon, a bit of 
fried egg dangling from his bushy mustache. “I know 
what 11 happen if that owl’s let out.” 

He exchanged dark looks with his wife, Petunia. 

Harry tried to argue back but his words were drowned 
by a long, loud belch from the Dursleys’ son, Dudley. 

Page | 2 Harry Potter and the Chamber of Secrets - J.K. Rowling 



“I want more bacon.” 



“There’s more in the frying pan, sweetums,” said Aunt 
Petunia, turning misty eyes on her massive son. “We 
must build you up while we’ve got the chance. ... I 
don’t like the sound of that school food. ...” 

“Nonsense, Petunia, I never went hungry when / was 
at Smeltings,” said Uncle Vernon heartily. “Dudley 
gets enough, don’t you, son?” 

Dudley, who was so large his bottom drooped over 
either side of the kitchen chair, grinned and turned to 
Harry. 

“Pass the frying pan.” 

“You’ve forgotten the magic word,” said Harry 
irritably. 

The effect of this simple sentence on the rest of the 
family was incredible: Dudley gasped and fell off his 
chair with a crash that shook the whole kitchen; Mrs. 
Dursley gave a small scream and clapped her hands 
to her mouth; Mr. Dursley jumped to his feet, veins 
throbbing in his temples. 

“I meant ‘please’!” said Harry quickly. “I didn’t mean 



“WHAT HAVE I TOLD YOU,” thundered his uncle, 
spraying spit over the table, “ABOUT SAYING THE ‘M’ 
WORD IN OUR HOUSE?” 

“But I — ” 

“HOW DARE YOU THREATEN DUDLEY!” roared 
Uncle Vernon, pounding the table with his fist. 



Page | 3 Harry Potter and the Chamber of Secrets - J.K. Rowling 




“I just — ” 



“I WARNED YOU! I WILL NOT TOLERATE MENTION 
OF YOUR ABNORMALITY UNDER THIS ROOF!” 

Harry stared from his purple-faced uncle to his pale 
aunt, who was trying to heave Dudley to his feet. 

“All right,” said Harry, “all right ...” 

Uncle Vernon sat back down, breathing like a winded 
rhinoceros and watching Harry closely out of the 
corners of his small, sharp eyes. 

Ever since Harry had come home for the summer 
holidays, Uncle Vernon had been treating him like a 
bomb that might go off at any moment, because Harry 
Potter wasn’t a normal boy. As a matter of fact, he 
was as not normal as it is possible to be. 

Harry Potter was a wizard — a wizard fresh from his 
first year at Hogwarts School of Witchcraft and 
Wizardry. And if the Dursleys were unhappy to have 
him back for the holidays, it was nothing to how 
Harry felt. 

He missed Hogwarts so much it was like having a 
constant stomachache. He missed the castle, with its 
secret passageways and ghosts, his classes (though 
perhaps not Snape, the Potions master), the mail 
arriving by owl, eating banquets in the Great Hall, 
sleeping in his four-poster bed in the tower dormitory, 
visiting the gamekeeper, Hagrid, in his cabin next to 
the Forbidden Forest in the grounds, and, especially, 
Quidditch, the most popular sport in the wizarding 
world (six tall goal posts, four flying balls, and 
fourteen players on broomsticks). 



Page | 4 Harry Potter and the Chamber of Secrets - J.K. Rowling 




All Harry’s spellbooks, his wand, robes, cauldron, and 
top-of-the-line Nimbus Two Thousand broomstick had 
been locked in a cupboard under the stairs by Uncle 
Vernon the instant Harry had come home. What did 
the Dursleys care if Harry lost his place on the House 
Quidditch team because he hadn’t practiced all 
summer? What was it to the Dursleys if Harry went 
back to school without any of his homework done? 

The Dursleys were what wizards called Muggles (not a 
drop of magical blood in their veins), and as far as 
they were concerned, having a wizard in the family 
was a matter of deepest shame. Uncle Vernon had 
even padlocked Harry’s owl, Hedwig, inside her cage, 
to stop her from carrying messages to anyone in the 
wizarding world. 

Harry looked nothing like the rest of the family. Uncle 
Vernon was large and neckless, with an enormous 
black mustache; Aunt Petunia was horse-faced and 
bony; Dudley was blond, pink, and porky. Harry, on 
the other hand, was small and skinny, with brilliant 
green eyes and jet-black hair that was always untidy. 
He wore round glasses, and on his forehead was a 
thin, lightning-shaped scar. 

It was this scar that made Harry so particularly 
unusual, even for a wizard. This scar was the only 
hint of Harry’s very mysterious past, of the reason he 
had been left on the Dursleys’ doorstep eleven years 
before. 

At the age of one year old, Harry had somehow 
survived a curse from the greatest Dark sorcerer of all 
time, Lord Voldemort, whose name most witches and 
wizards still feared to speak. Harry’s parents had died 
in Voldemort’s attack, but Harry had escaped with his 
lightning scar, and somehow — nobody understood 
why — Voldemort’s powers had been destroyed the 
instant he had failed to kill Harry. 

Page | 5 Harry Potter and the Chamber of Secrets - J.K. Rowling 




So Harry had been brought up by his dead mother’s 
sister and her husband. He had spent ten years with 
the Dursleys, never understanding why he kept 
making odd things happen without meaning to, 
believing the Dursleys’ story that he had got his scar 
in the car crash that had killed his parents. 

And then, exactly a year ago, Hogwarts had written to 
Harry, and the whole story had come out. Harry had 
taken up his place at wizard school, where he and his 
scar were famous . . . but now the school year was 
over, and he was back with the Dursleys for the 
summer, back to being treated like a dog that had 
rolled in something smelly. 

The Dursleys hadn’t even remembered that today 
happened to be Harry’s twelfth birthday. Of course, 
his hopes hadn’t been high; they’d never given him a 
real present, let alone a cake — but to ignore it 
completely ... 

At that moment, Uncle Vernon cleared his throat 
importantly and said, “Now, as we all know, today is a 
very important day.” 

Harry looked up, hardly daring to believe it. 

“This could well be the day I make the biggest deal of 
my career,” said Uncle Vernon. 

Harry went back to his toast. Of course, he thought 
bitterly, Uncle Vernon was talking about the stupid 
dinner party. He’d been talking of nothing else for two 
weeks. Some rich builder and his wife were coming to 
dinner and Uncle Vernon was hoping to get a huge 
order from him (Uncle Vernon’s company made drills). 



Page | 6 Harry Potter and the Chamber of Secrets - J.K. Rowling 




“I think we should run through the schedule one 
more time,” said Uncle Vernon. “We should all be in 
position at eight o’clock. Petunia, you will be — ?” 

“In the lounge,” said Aunt Petunia promptly, “waiting 
to welcome them graciously to our home.” 

“Good, good. And Dudley?” 

“I’ll be waiting to open the door.” Dudley put on a 
foul, simpering smile. “May I take your coats, Mr. and 
Mrs. Mason?” 

“They’ll love him!” cried Aunt Petunia rapturously. 

“Excellent, Dudley,” said Uncle Vernon. Then he 
rounded on Harry. “And you?” 

“I’ll be in my bedroom, making no noise and 
pretending I’m not there,” said Harry tonelessly. 

“Exactly,” said Uncle Vernon nastily. “I will lead them 
into the lounge, introduce you, Petunia, and pour 
them drinks. At eight-fifteen — ” 

“I’ll announce dinner,” said Aunt Petunia. 

“And, Dudley, you 11 say — ” 

“May I take you through to the dining room, Mrs. 
Mason?” said Dudley, offering his fat arm to an 
invisible woman. 

“My perfect little gentleman!” sniffed Aunt Petunia. 

“And you?” said Uncle Vernon viciously to Harry. 

“I’ll be in my room, making no noise and pretending 
I’m not there,” said Harry dully. 

Page | 7 Harry Potter and the Chamber of Secrets - J.K. Rowling 




“Precisely. Now, we should aim to get in a few good 
compliments at dinner. Petunia, any ideas?” 



“Vernon tells me you’re a wonderful golfer, Mr. 

Mason. ... Do tell me where you bought your dress, 
Mrs. Mason. ...” 

“Perfect ... Dudley?” 

“How about — ‘We had to write an essay about our 
hero at school, Mr. Mason, and I wrote about you.’ ” 

This was too much for both Aunt Petunia and Harry. 
Aunt Petunia burst into tears and hugged her son, 
while Harry ducked under the table so they wouldn’t 
see him laughing. 

“And you, boy?” 

Harry fought to keep his face straight as he emerged. 

“I’ll be in my room, making no noise and pretending 
I’m not there,” he said. 

“Too right, you will,” said Uncle Vernon forcefully. 

“The Masons don’t know anything about you and it’s 
going to stay that way. When dinner’s over, you take 
Mrs. Mason back to the lounge for coffee, Petunia, 
and I’ll bring the subject around to drills. With any 
luck, I’ll have the deal signed and sealed before the 
news at ten. We’ll be shopping for a vacation home in 
Majorca this time tomorrow.” 

Harry couldn’t feel too excited about this. He didn’t 
think the Dursleys would like him any better in 
Majorca than they did on Privet Drive. 

“Right — I’m off into town to pick up the dinner 
jackets for Dudley and me. And you,” he snarled at 

Page | 8 Harry Potter and the Chamber of Secrets - J.K. Rowling 




Harry. “You stay out of your aunt’s way while she’s 
cleaning.” 

Harry left through the back door. It was a brilliant, 
sunny day. He crossed the lawn, slumped down on 
the garden bench, and sang under his breath: 

“Happy birthday to me ... happy birthday to me ...” 

No cards, no presents, and he would be spending the 
evening pretending not to exist. He gazed miserably 
into the hedge. He had never felt so lonely. More than 
anything else at Hogwarts, more even than playing 
Quidditch, Harry missed his best friends, Ron 
Weasley and Hermione Granger. They, however, didn’t 
seem to be missing him at all. Neither of them had 
written to him all summer, even though Ron had said 
he was going to ask Harry to come and stay. 

Countless times, Harry had been on the point of 
unlocking Hedwig’s cage by magic and sending her to 
Ron and Hermione with a letter, but it wasn’t worth 
the risk. Underage wizards weren’t allowed to use 
magic outside of school. Harry hadn’t told the 
Dursleys this; he knew it was only their terror that he 
might turn them all into dung beetles that stopped 
them from locking him in the cupboard under the 
stairs with his wand and broomstick. For the first 
couple of weeks back, Harry had enjoyed muttering 
nonsense words under his breath and watching 
Dudley tearing out of the room as fast as his fat legs 
would carry him. But the long silence from Ron and 
Hermione had made Harry feel so cut off from the 
magical world that even taunting Dudley had lost its 
appeal — and now Ron and Hermione had forgotten 
his birthday. 

What wouldn’t he give now for a message from 
Hogwarts? From any witch or wizard? He’d almost be 

Page | 9 Harry Potter and the Chamber of Secrets - J.K. Rowling 




glad of a sight of his archenemy, Draco Malfoy, just to 
be sure it hadn’t all been a dream. ... 

Not that his whole year at Hogwarts had been fun. At 
the very end of last term, Harry had come face-to-face 
with none other than Lord Voldemort himself. 
Voldemort might be a ruin of his former self, but he 
was still terrifying, still cunning, still determined to 
regain power. Harry had slipped through Voldemort’s 
clutches for a second time, but it had been a narrow 
escape, and even now, weeks later, Harry kept waking 
in the night, drenched in cold sweat, wondering where 
Voldemort was now, remembering his livid face, his 
wide, mad eyes — 

Harry suddenly sat bolt upright on the garden bench. 
He had been staring absent-mindedly into the hedge 
— and the hedge was staring back. Two enormous 
green eyes had appeared among the leaves. 

Harry jumped to his feet just as a jeering voice floated 
across the lawn. 

“I know what day it is,” sang Dudley, waddling toward 
him. 

The huge eyes blinked and vanished. 

“What?” said Harry, not taking his eyes off the spot 
where they had been. 

“I know what day it is,” Dudley repeated, coming right 
up to him. 

“Well done,” said Harry. “So you’ve finally learned the 
days of the week.” 



Page | 10 Harry Potter and the Chamber of Secrets - J.K. Rowling 




“Today’s your birthday,” sneered Dudley. “How come 
you haven’t got any cards? Haven’t you even got 
friends at that freak place?” 

“Better not let your mum hear you talking about my 
school,” said Harry coolly. 

Dudley hitched up his trousers, which were slipping 
down his fat bottom. 

“Why’re you staring at the hedge?” he said 
suspiciously. 

“I’m trying to decide what would be the best spell to 
set it on fire,” said Harry. 

Dudley stumbled backward at once, a look of panic 
on his fat face. 

“You c-can’t — Dad told you you’re not to do m-magic 
— he said hell chuck you out of the house — and you 
haven’t got anywhere else to go — you haven’t got any 
friends to take you — ” 

“ Jiggery pokeryV ’ said Harry in a fierce voice. “Hocus 
pocus — squiggly wiggly — ” 

“MUUUUUUM!” howled Dudley, tripping over his feet 
as he dashed back toward the house. “MUUUUM! 

He’s doing you know what!” 

Harry paid dearly for his moment of fun. As neither 
Dudley nor the hedge was in any way hurt, Aunt 
Petunia knew he hadn’t really done magic, but he still 
had to duck as she aimed a heavy blow at his head 
with the soapy frying pan. Then she gave him work to 
do, with the promise he wouldn’t eat again until he’d 
finished. 



Page | 11 Harry Potter and the Chamber of Secrets - J.K. Rowling 




While Dudley lolled around watching and eating ice 
cream, Harry cleaned the windows, washed the car, 
mowed the lawn, trimmed the flowerbeds, pruned and 
watered the roses, and repainted the garden bench. 
The sun blazed overhead, burning the back of his 
neck. Harry knew he shouldn’t have risen to Dudley’s 
bait, but Dudley had said the very thing Harry had 
been thinking himself ... maybe he didn’t have any 
friends at Hogwarts. ... 

Wish they could see famous Harry Potter now, he 
thought savagely as he spread manure on the flower 
beds, his back aching, sweat running down his face. 

It was half past seven in the evening when at last, 
exhausted, he heard Aunt Petunia calling him. 

“Get in here! And walk on the newspaper!” 

Harry moved gladly into the shade of the gleaming 
kitchen. On top of the fridge stood tonight’s pudding: 
a huge mound of whipped cream and sugared violets. 
A loin of roast pork was sizzling in the oven. 

“Eat quickly! The Masons will be here soon!” snapped 
Aunt Petunia, pointing to two slices of bread and a 
lump of cheese on the kitchen table. She was already 
wearing a salmon-pink cocktail dress. 

Harry washed his hands and bolted down his pitiful 
supper. The moment he had finished, Aunt Petunia 
whisked away his plate. “Upstairs! Hurry!” 

As he passed the door to the living room, Harry 
caught a glimpse of Uncle Vernon and Dudley in bow 
ties and dinner jackets. He had only just reached the 
upstairs landing when the doorbell rang and Uncle 
Vernon’s furious face appeared at the foot of the 
stairs. 

Page | 12 Harry Potter and the Chamber of Secrets - J.K. Rowling 




“Remember, boy — one sound — ” 

Harry crossed to his bedroom on tiptoe, slipped 
inside, closed the door, and turned to collapse on his 
bed. 

The trouble was, there was already someone sitting 
on it. 



Page | 13 Harry Potter and the Chamber of Secrets - J.K. Rowling 






DOBBY’S WARNING 

Harry managed not to shout out, but it was a close 
thing. The little creature on the bed had large, bat- 
like ears and bulging green eyes the size of tennis 
balls. Harry knew instantly that this was what had 
been watching him out of the garden hedge that 
morning. 

As they stared at each other, Harry heard Dudley’s 
voice from the hall. 

“May I take your coats, Mr. and Mrs. Mason?” 

The creature slipped off the bed and bowed so low 
that the end of its long, thin nose touched the carpet. 
Harry noticed that it was wearing what looked like an 
old pillowcase, with rips for arm- and leg-holes. 

“Er — hello,” said Harry nervously. 

“Harry Potter!” said the creature in a high-pitched 
voice Harry was sure would carry down the stairs. “So 



Page | 14 Harry Potter and the Chamber of Secrets - J.K. Rowling 



long has Dobby wanted to meet you, sir ... Such an 
honor it is. ...” 

“Th-thank you,” said Harry, edging along the wall and 
sinking into his desk chair, next to Hedwig, who was 
asleep in her large cage. He wanted to ask, “What are 
you?” but thought it would sound too rude, so instead 
he said, “Who are you?” 

“Dobby, sir. Just Dobby. Dobby the house-elf,” said 
the creature. 

“Oh — really?” said Harry. “Er — I don’t want to be 
rude or anything, but — this isn’t a great time for me 
to have a house-elf in my bedroom.” 

Aunt Petunia’s high, false laugh sounded from the 
living room. The elf hung his head. 

“Not that I’m not pleased to meet you,” said Harry 
quickly, “but, er, is there any particular reason you’re 
here?” 

“Oh, yes, sir,” said Dobby earnestly. “Dobby has come 
to tell you, sir ... it is difficult, sir ... Dobby wonders 
where to begin. ...” 

“Sit down,” said Harry politely, pointing at the bed. 

To his horror, the elf burst into tears — very noisy 
tears. 

“S-sit down).” he wailed. “Never ... never ever ...” 

Harry thought he heard the voices downstairs falter. 

“I’m sorry,” he whispered, “I didn’t mean to offend you 
or anything — ” 



Page | 15 Harry Potter and the Chamber of Secrets - J.K. Rowling 




“Offend Dobby!” choked the elf. “Dobby has never 
been asked to sit down by a wizard — like an equal — 



Harry, trying to say “Shh!” and look comforting at the 
same time, ushered Dobby back onto the bed where 
he sat hiccoughing, looking like a large and very ugly 
doll. At last he managed to control himself, and sat 
with his great eyes fixed on Harry in an expression of 
watery adoration. 

“You can’t have met many decent wizards,” said 
Harry, trying to cheer him up. 

Dobby shook his head. Then, without warning, he 
leapt up and started banging his head furiously on 
the window, shouting, “Bad Dobby! Bad Dobby!” 

“Don’t — what are you doing?” Harry hissed, 
springing up and pulling Dobby back onto the bed — 
Hedwig had woken up with a particularly loud 
screech and was beating her wings wildly against the 
bars of her cage. 

“Dobby had to punish himself, sir,” said the elf, who 
had gone slightly cross-eyed. “Dobby almost spoke ill 
of his family, sir. ...” 

“Your family?” 

“The wizard family Dobby serves, sir. ... Dobby is a 
house-elf — bound to serve one house and one family 
forever. ...” 

“Do they know you’re here?” asked Harry curiously. 
Dobby shuddered. 



Page | 16 Harry Potter and the Chamber of Secrets - J.K. Rowling 




“Oh, no, sir, no ... Dobby will have to punish himself 
most grievously for coming to see you, sir. Dobby will 
have to shut his ears in the oven door for this. If they 
ever knew, sir — ” 

“But won’t they notice if you shut your ears in the 
oven door?” 

“Dobby doubts it, sir. Dobby is always having to 
punish himself for something, sir. They lets Dobby get 
on with it, sir. Sometimes they reminds me to do 
extra punishments. ...” 

“But why don’t you leave? Escape?” 

“A house-elf must be set free, sir. And the family will 
never set Dobby free . . . Dobby will serve the family 
until he dies, sir. ...” 

Harry stared. 

“And I thought I had it bad staying here for another 
four weeks,” he said. “This makes the Dursleys sound 
almost human. Can’t anyone help you? Can’t I?” 

Almost at once, Harry wished he hadn’t spoken. 

Dobby dissolved again into wails of gratitude. 

“Please,” Harry whispered frantically, “please be quiet. 
If the Dursleys hear anything, if they know you’re 
here — ” 

“Harry Potter asks if he can help Dobby . . . Dobby has 
heard of your greatness, sir, but of your goodness, 
Dobby never knew. ...” 

Harry, who was feeling distinctly hot in the face, said, 
“Whatever you’ve heard about my greatness is a load 



Page | 17 Harry Potter and the Chamber of Secrets - J.K. Rowling 




of rubbish. I’m not even top of my year at Hogwarts; 
that’s Hermione, she — ” 

But he stopped quickly, because thinking about 
Hermione was painful. 

“Harry Potter is humble and modest,” said Dobby 
reverently, his orb-like eyes aglow. “Harry Potter 
speaks not of his triumph over He-Who-Must-Not-Be- 
Named — ” 

“Voldemort?” said Harry. 

Dobby clapped his hands over his bat ears and 
moaned, “Ah, speak not the name, sir! Speak not the 
name!” 

“Sorry,” said Harry quickly. “I know lots of people 
don’t like it. My friend Ron — ” 

He stopped again. Thinking about Ron was painful, 
too. 

Dobby leaned toward Harry, his eyes wide as 
headlights. 

“Dobby heard tell,” he said hoarsely, “that Harry 
Potter met the Dark Lord for a second time, just 
weeks ago ... that Harry Potter escaped yet again.” 

Harry nodded and Dobby’s eyes suddenly shone with 
tears. 

“Ah, sir,” he gasped, dabbing his face with a corner of 
the grubby pillowcase he was wearing. “Harry Potter 
is valiant and bold! He has braved so many dangers 
already! But Dobby has come to protect Harry Potter, 
to warn him, even if he does have to shut his ears in 



Page | 18 Harry Potter and the Chamber of Secrets - J.K. Rowling 




the oven door later. . . . Harry Potter must not go back 
to Hogwarts.” 

There was a silence broken only by the chink of 
knives and forks from downstairs and the distant 
rumble of Uncle Vernon’s voice. 

“W-what?” Harry stammered. “But I’ve got to go back 
— term starts on September first. It’s all that’s 
keeping me going. You don’t know what it’s like here. 

I don’t belong here. I belong in your world — at 
Hogwarts.” 

“No, no, no,” squeaked Dobby, shaking his head so 
hard his ears flapped. “Harry Potter must stay where 
he is safe. He is too great, too good, to lose. If Harry 
Potter goes back to Hogwarts, he will be in mortal 
danger.” 

“Why?” said Harry in surprise. 

“There is a plot, Harry Potter. A plot to make most 
terrible things happen at Hogwarts School of 
Witchcraft and Wizardry this year,” whispered Dobby, 
suddenly trembling all over. “Dobby has known it for 
months, sir. Harry Potter must not put himself in 
peril. He is too important, sir!” 

“What terrible things?” said Harry at once. “Who’s 
plotting them?” 

Dobby made a funny choking noise and then banged 
his head frantically against the wall. 

“All right!” cried Harry, grabbing the elf’s arm to stop 
him. “You can’t tell me. I understand. But why are 
you warning me?” A sudden, unpleasant thought 
struck him. “Hang on — this hasn’t got anything to 
do with Vol — sorry — with You-Know-Who, has it? 
Page | 19 Harry Potter and the Chamber of Secrets - J.K. Rowling 




You could just shake or nod,” he added hastily as 
Dobby’s head tilted worryingly close to the wall again. 

Slowly, Dobby shook his head. 

“Not — not He-Who-Must-Not-Be-Named, sir — ” 

But Dobby’s eyes were wide and he seemed to be 
trying to give Harry a hint. Harry, however, was 
completely lost. 

“He hasn’t got a brother, has he?” 

Dobby shook his head, his eyes wider than ever. 

“Well then, I can’t think who else would have a 
chance of making horrible things happen at 
Hogwarts,” said Harry. “I mean, there’s Dumbledore, 
for one thing — you know who Dumbledore is, don’t 
you?” 

Dobby bowed his head. 

“Albus Dumbledore is the greatest headmaster 
Hogwarts has ever had. Dobby knows it, sir. Dobby 
has heard Dumbledore’s powers rival those of He- 
Who-Must-Not-Be-Named at the height of his 
strength. But, sir” — Dobby’s voice dropped to an 
urgent whisper — “there are powers Dumbledore 
doesn’t ... powers no decent wizard ...” 

And before Harry could stop him, Dobby bounded off 
the bed, seized Harry’s desk lamp, and started 
beating himself around the head with earsplitting 
yelps. 

A sudden silence fell downstairs. Two seconds later 
Harry, heart thudding madly, heard Uncle Vernon 



Page | 20 Harry Potter and the Chamber of Secrets - J.K. Rowling 




coming into the hall, calling, “Dudley must have left 
his television on again, the little tyke!” 

“Quick! In the closet!” hissed Harry, stuffing Dobby 
in, shutting the door, and flinging himself onto the 
bed just as the door handle turned. 

“What — the — devil — are — you — doing?” said 
Uncle Vernon through gritted teeth, his face horribly 
close to Harry’s. “You’ve just ruined the punch line of 
my Japanese golfer joke. ... One more sound and 
you’ll wish you’d never been born, boy!” 

He stomped flat-footed from the room. 

Shaking, Harry let Dobby out of the closet. 

“See what it’s like here?” he said. “See why I’ve got to 
go back to Hogwarts? It’s the only place I’ve got — 
well, I think I’ve got friends.” 

“Friends who don’t even write to Harry Potter?” said 
Dobby slyly. 

“I expect they’ve just been — wait a minute,” said 
Harry, frowning. “How do you know my friends 
haven’t been writing to me?” 

Dobby shuffled his feet. 

“Harry Potter mustn’t be angry with Dobby. Dobby 
did it for the best — ” 

“Have you been stopping my letters?” 

“Dobby has them here, sir,” said the elf. Stepping 
nimbly out of Harry’s reach, he pulled a thick wad of 
envelopes from the inside of the pillowcase he was 
wearing. Harry could make out Hermione’s neat 

Page | 21 Harry Potter and the Chamber of Secrets - J.K. Rowling 




writing, Ron’s untidy scrawl, and even a scribble that 
looked as though it was from the Hogwarts 
gamekeeper, Hagrid. 

Dobby blinked anxiously up at Harry. 

“Harry Potter mustn’t be angry. ... Dobby hoped ... if 
Harry Potter thought his friends had forgotten him . . . 
Harry Potter might not want to go back to school, sir. 



Harry wasn’t listening. He made a grab for the letters, 
but Dobby jumped out of reach. 

“Harry Potter will have them, sir, if he gives Dobby his 
word that he will not return to Hogwarts. Ah, sir, this 
is a danger you must not face! Say you won’t go back, 
sir!” 

“No,” said Harry angrily. “Give me my friends’ letters!” 

“Then Harry Potter leaves Dobby no choice,” said the 
elf sadly. 

Before Harry could move, Dobby had darted to the 
bedroom door, pulled it open, and sprinted down the 
stairs. 

Mouth dry, stomach lurching, Harry sprang after him, 
trying not to make a sound. He jumped the last six 
steps, landing catlike on the hall carpet, looking 
around for Dobby. From the dining room he heard 
Uncle Vernon saying, ""... tell Petunia that very funny 
story about those American plumbers, Mr. Mason. 
She’s been dying to hear ...” 

Harry ran up the hall into the kitchen and felt his 
stomach disappear. 



Page | 22 Harry Potter and the Chamber of Secrets - J.K. Rowling 




Aunt Petunia’s masterpiece of a pudding, the 
mountain of cream and sugared violets, was floating 
up near the ceiling. On top of a cupboard in the 
corner crouched Dobby. 

“No,” croaked Harry. “Please ... they’ll kill me. ...” 
“Harry Potter must say he’s not going back to school 



“Dobby ... please ...” 

“Say it, sir — ” 

“I can’t — ” 

Dobby gave him a tragic look. 

“Then Dobby must do it, sir, for Harry Potter’s own 
good.” 

The pudding fell to the floor with a heart-stopping 
crash. Cream splattered the windows and walls as the 
dish shattered. With a crack like a whip, Dobby 
vanished. 

There were screams from the dining room and Uncle 
Vernon burst into the kitchen to find Harry, rigid with 
shock, covered from head to foot in Aunt Petunia’s 
pudding. 

At first, it looked as though Uncle Vernon would 
manage to gloss the whole thing over. (“Just our 
nephew — very disturbed — meeting strangers upsets 
him, so we kept him upstairs. ...”) He shooed the 
shocked Masons back into the dining room, promised 
Harry he would flay him to within an inch of his life 
when the Masons had left, and handed him a mop. 
Aunt Petunia dug some ice cream out of the freezer 
Page | 23 Harry Potter and the Chamber of Secrets - J.K. Rowling 




and Harry, still shaking, started scrubbing the 
kitchen clean. 

Uncle Vernon might still have been able to make his 
deal — if it hadn’t been for the owl. 

Aunt Petunia was just passing around a box of after- 
dinner mints when a huge barn owl swooped through 
the dining room window, dropped a letter on Mrs. 
Mason’s head, and swooped out again. Mrs. Mason 
screamed like a banshee and ran from the house 
shouting about lunatics. Mr. Mason stayed just long 
enough to tell the Dursleys that his wife was mortally 
afraid of birds of all shapes and sizes, and to ask 
whether this was their idea of a joke. 

Harry stood in the kitchen, clutching the mop for 
support, as Uncle Vernon advanced on him, a 
demonic glint in his tiny eyes. 

“Read it!” he hissed evilly, brandishing the letter the 
owl had delivered. “Go on — read it!” 

Harry took it. It did not contain birthday greetings. 

Dear Mr. Potter, 

We have received intelligence that a Hover Charm was 
used at your place of residence this evening at twelve 
minutes past nine. 

As you know, underage wizards are not permitted to 
perform spells outside school, and further spellwork on 
your part may lead to expulsion from said school 
(Decree for the Reasonable Restriction of Underage 
Sorcery, 1875, Paragraph C). 

We would also ask you to remember that any magical 
activity that risks notice by members of the non- 

P a g e | 24 Harry Potter and the Chamber of Secrets - J.K. Rowling 




magical community (Muggles) is a serious offense 
under section 13 of the International Confederation of 
Warlocks’ Statute of Secrecy. 

Enjoy your holidays! 

Yours sincerely, 

Mafalda Hopkirk 

IMPROPER USE OF MAGIC OFFICE 
Ministry of Magic 

Harry looked up from the letter and gulped. 

“You didn’t tell us you weren’t allowed to use magic 
outside school,” said Uncle Vernon, a mad gleam 
dancing in his eyes. “Forgot to mention it. ... Slipped 
your mind, I daresay. ...” 

He was bearing down on Harry like a great bulldog, 
all his teeth bared. “Well, I’ve got news for you, boy. ... 
I’m locking you up. ... You’re never going back to that 
school . . . never . . . and if you try and magic yourself 
out — they 11 expel you!” 

And laughing like a maniac, he dragged Harry back 
upstairs. 

Uncle Vernon was as bad as his word. The following 
morning, he paid a man to fit bars on Harry’s window. 
He himself fitted a cat-flap in the bedroom door, so 
that small amounts of food could be pushed inside 
three times a day. They let Harry out to use the 
bathroom morning and evening. Otherwise, he was 
locked in his room around the clock. 



Page | 25 Harry Potter and the Chamber of Secrets - J.K. Rowling 




Three days later, the Dursleys were showing no sign 
of relenting, and Harry couldn’t see any way out of his 
situation. He lay on his bed watching the sun sinking 
behind the bars on the window and wondered 
miserably what was going to happen to him. 

What was the good of magicking himself out of his 
room if Hogwarts would expel him for doing it? Yet life 
at Privet Drive had reached an all-time low. Now that 
the Dursleys knew they weren’t going to wake up as 
fruit bats, he had lost his only weapon. Dobby might 
have saved Harry from horrible happenings at 
Hogwarts, but the way things were going, he’d 
probably starve to death anyway. 

The cat-flap rattled and Aunt Petunia’s hand 
appeared, pushing a bowl of canned soup into the 
room. Harry, whose insides were aching with hunger, 
jumped off his bed and seized it. The soup was stone- 
cold, but he drank half of it in one gulp. Then he 
crossed the room to Hedwig’s cage and tipped the 
soggy vegetables at the bottom of the bowl into her 
empty food tray. She ruffled her feathers and gave 
him a look of deep disgust. 

“It’s no good turning your beak up at it — that’s all 
we’ve got,” said Harry grimly. 

He put the empty bowl back on the floor next to the 
cat-flap and lay back down on the bed, somehow even 
hungrier than he had been before the soup. 

Supposing he was still alive in another four weeks, 
what would happen if he didn’t turn up at Hogwarts? 
Would someone be sent to see why he hadn’t come 
back? Would they be ab"
